한국전력공사home.kepco.co.kr저장된 페이지서울 · 남서울 · 인천 · 경기북부 · 경기 · 강원 · 충북 · 대전세종충남 · 전북 · 광주 ...,http://home.kepco.co.kr/
"한국전력공사 - 나무위키https://namu.wiki › 한국전력공사유사한 페이지2019. 10. 31. - <b>한전</b>은 여기로 연결됩니다. 파주시 마을버스 회사인 '한전운수'에 대한 내용은 한전운수 문서를, 삼성동 舊 한전본사에 들어오는 현대자동차 ...한국전력공사 채용한국전력공사 이슈한국전력공사 연봉한국전력공사 조직도한국전력공사 로고한국전력공사 사업함께 검색한 항목",https://namu.wiki/w/%ED%95%9C%EA%B5%AD%EC%A0%84%EB%A0%A5%EA%B3%B5%EC%82%AC
"강원 춘천시 후평동의 한국전력공사 | junkigas.comhttps://junkigas.com › gangwon-do › chuncheon-si › hupyeong-dong저장된 페이지강원 춘천시 후평동(으)로 이사하셔서 한국전력공사(KEPCO) 에 전기사용신청을 하고 싶으시다면? 기존 설비로 공급이 가능하신 경우, 또 주택용 및 계약 전력 5kW ...",https://junkigas.com/gangwon-do/chuncheon-si/hupyeong-dong
"한국전력공사 - 위키백과, 우리 모두의 백과사전https://ko.wikipedia.org › wiki › 한국전력공사저장된 페이지유사한 페이지한국전력공사(韓國電力公社, Korea Electric Power Corporation, KEPCO)는 대한민국의 전력공급을 위해 설립된 대한민국 산업통상자원부 산하 시장형 공기업이다.한국전력공사 이슈한국전력공사 조직도한국전력공사 연봉한국전력공사 로고한국전력공사 사업전기요금 조회함께 검색한 항목",https://ko.wikipedia.org/wiki/%ED%95%9C%EA%B5%AD%EC%A0%84%EB%A0%A5%EA%B3%B5%EC%82%AC
"한국전력공사(KEPCO) - 홈 | Facebookhttps://ko-kr.facebook.com › 장소 › 전라남도 나주저장된 페이지유사한 페이지 평점: 3.8 - ‎259표한국전력공사(KEPCO) - 전라남도 나주시 전력로 55, 전라남도 나주 58217 - 평점 3.8, ""나주혁신도시 지날때 마다 듬직합니다 많은 일자리로 빛내주셔서 더욱 발 .한국전력공사 이슈한전 전기요금 계산한국전력공사 채용스마트한전한국전력공사 조직도한국전력공사 로고함께 검색한 항목",https://ko-kr.facebook.com/iamkepco/
"한국전력공사 기업정보 | 잡코리아https://www.jobkorea.co.kr › Company저장된 페이지한국전력공사 기업정보 - 최신 소식 및 기업문화, 근무환경, 채용정보, 인재상 등의 기업정보를 잡코리아에서 공개합니다.한국전력공사 사이버한국전력공사 주가한국전력공사 채용한국전력공사 이슈한국전력공사 로고한전 2018 합격 자소서함께 검색한 항목",https://www.jobkorea.co.kr/Company/1415214
"한국전력공사 저소득층에 체납전기료 깎아줘 | 한경닷컴https://www.hankyung.com › economy › article저장된 페이지2019. 10. 10. - 한국전력공사(KEPCO)에선 전 직원이 사회봉사단에 참여하고 있다. 전국 311개 사업소 2만여 명의 직원으로 구성돼 있으며, 공기업 중에선 최대 ...",https://www.hankyung.com/economy/article/2019101044141
